Infinite Treasures Are Ours	Los tesoros infinitos son nuestros
The Standard Reference Text—Historical Context and Purpose	El texto de referencia estándar: contexto histórico y propósito
Updates from the October 2020 Trustee Meeting	Actualizaciones de la reunión de administradores de octubre de 2020
Chinese Conference Generates Enthusiasm for The Urantia Book	La conferencia china genera entusiasmo por El libro de Urantia
Remembering Carolyn Kendall	Recordando a Carolyn Kendall
Urantia Book Internet School—an Opportunity for Spiritual Growth and Brotherhood	Escuela en Internet del Libro de Urantia: una oportunidad para el crecimiento espiritual y la hermandad
Urantia Book Internet School—a Brazilian Experience	Escuela en Internet del Libro de Urantia: una experiencia brasileña
What The Urantia Book Means to Me-the Dimensions of God	Lo que El Libro de Urantia significa para mí: las dimensiones de Dios
Announcements	Anuncios
Volume 15, 2021	Volumen 15, 2021
Volume 15, Issue 1, April 2021	Volumen 15, Número 1, abril de 2021
Welcome & Contact Details	Bienvenido y detalles de contacto
Springtime for the New El libro de Urantia	Primavera para el nuevo El libro de Urantia
Updates from the January 2021 Trustee Meeting	Actualizaciones de la reunión de administradores de enero de 2021
The Urantia Book in Europe—Our Journey Building a Distribution Network	El libro de Urantia en Europa: nuestro viaje construyendo una red de distribución
Loving Service Spiritual Retreat —The Power of Stories	Retiro espiritual de servicio amoroso: el poder de las historias
Urantia Foundation Outreach Committee	Comité de extensión de la Fundación Urantia
Dancing with God—Living in Love in Trying Times	Bailando con Dios: vivir en amor en tiempos difíciles
New Enhanced English E-book	Nuevo libro electrónico en inglés mejorado
Learn About the New Revision of El Libro de Urantia	Conozca más sobre la nueva revisión de El Libro de Urantia
Volume 15, Issue 2, July 2021	Volumen 15, Número 2, julio de 2021
Welcome & Contact Details	Bienvenido y detalles de contacto
Taking It to a New Level: The Urantia Book in Esperanto	Llevándolo a un nuevo nivel: El libro de Urantia en esperanto
Updates from the April 2021 Trustee Meeting	Actualizaciones de la reunión de administradores de abril de 2021
My Experiences with the Spanish Revision	Mis experiencias con la revisión española
Distributing Het Urantia Boek in the Netherlands and Belgium	Distribución de Het Urantia Book en los Países Bajos y Bélgica
Experiencing International Brotherhood through Urantia Book Internet School	Experimentar la hermandad internacional a través de la Escuela de Internet del Libro de Urantia
Teamwork: A Virtual Conference Experience	Trabajo en equipo: una experiencia de conferencia virtual
What The Urantia Book Means to Me	Lo que el libro de Urantia significa para mí
Announcements	Anuncios
Volume 15, Issue 3, Sept. 2021	Volumen 15, Número 3, septiembre de 2021
Welcome & Contact Details	Bienvenido y detalles de contacto
Maximizing Outreach with an Android App	Maximizar el alcance con una aplicación de Android
Updates from the July Trustee Meeting	Actualizaciones de la reunión de administradores de julio
A Decade of Quality and Dedication — the Revision of El Libro de Urantia	Una década de calidad y dedicación: la revisión de El Libro de Urantia
The Effect of Supply Chains on Book Printing and Distribution	El efecto de las cadenas de suministro en la impresión y distribución de libros
The Enduring Legacy of Two Great Teachers	El legado perdurable de dos grandes maestros
A Quadrimillennial Appreciation of Machiventa Melchizedek	Una apreciación cuadrimilenaria de Maquiventa Melquisedec
Three Concentric Circles — Our Michael Son's Banner	Tres círculos concéntricos: el estandarte de nuestro hijo Miguel
Sharing The Urantia Book	Compartiendo el libro de Urantia
What The Urantia Book Means to Me	Lo que el libro de Urantia significa para mí
Science Symposium III	III Simposio Científico
Volume 16, 2022	Volumen 16, 2022
Volume 16, Issue 1, Jan. 2022	Volumen 16, Número 1, enero de 2022
Welcome & Contact Details	Bienvenido y detalles de contacto
2022 Here We Come!	2022 ¡Aquí vamos!
Updates from the October 2021 Trustee Meeting	Actualizaciones de la reunión de administradores de octubre de 2021
The Chinese Translation: An Update	La traducción china: una actualización
Circling the Globe with UBIS	La vuelta al mundo con la UBIS
My Benelux Esperanto Conference Experience	Mi experiencia en la conferencia de esperanto del Benelux
Remembering Irmeli Ivalo-Sjõlie	Recordando a Irmeli Ivalo-Sjõlie
Sharing The Urantia Book	Compartiendo el libro de Urantia
What The Urantia Book Means to Me	Lo que el libro de Urantia significa para mí
Volume 16, Issue 2, March 2022	Volumen 16, Número 2, marzo de 2022
Welcome & Contact Details	Bienvenido y detalles de contacto
Ksiega Urantii: How the Polish Translation Came to Be	Ksiega Urantii: cómo surgió la traducción polaca
Updates from the January 2022 Trustee Meeting	Actualizaciones de la reunión de administradores de enero de 2022
The Inquiring Greeks: A Chronicle of the Greek Translation of The Urantia Book	Los griegos inquisitivos: una crónica de la traducción griega del libro de Urantia
Urantia Foundation: Enhancing a Global Movement	Fundación Urantia: Mejorando un movimiento global
An Indispensable Partnership: The Pipeline of Light	Una asociación indispensable: el oleoducto de la luz
Collaboration and Spiritual Unity: The Urantia Book Study Group Directory	Colaboración y unidad espiritual: Directorio de grupos de estudio de El libro de Urantia
Joining the Team at Urantia Foundation	Unirse al equipo de la Fundación Urantia
Sharing The Urantia Book	Compartiendo el libro de Urantia
What The Urantia Book Means to Me	Lo que el libro de Urantia significa para mí
Announcements	Anuncios
Volume 16, Issue 3, July 2022	Volumen 16, Número 3, julio de 2022
Welcome & Contact Details	Bienvenido y detalles de contacto
Science: The Interface of Evolution and Revelation	Ciencia: la interfaz entre evolución y revelación
Updates from the April 2022 Trustee Meeting	Actualizaciones de la reunión de administradores de abril de 2022
The Cultural Advisory Council Welcomes Brazil	El Consejo Consultivo Cultural da la bienvenida a Brasil
Urantia Book Internet School—Study Groups for New Readers	Escuela en Internet del Libro de Urantia: grupos de estudio para nuevos lectores
Three Ways to Help Spread the Urantia Revelation	Tres maneras de ayudar a difundir la Revelación Urantia
A Tribute to Dr. Marta Elders—Our Love of a Lady	Un tributo a la Dra. Marta Elders: nuestro amor de dama
What The Urantia Book Means to Me	Lo que el libro de Urantia significa para mí
Announcements	Anuncios
Volume 16, Issue 4, Oct. 2022	Volumen 16, Número 4, octubre de 2022
Welcome & Contact Details	Bienvenido y detalles de contacto
Urantia Books across the Globe	Libros de Urantia en todo el mundo
Updates from the July 2022 Trustee Meeting	Actualizaciones de la reunión de administradores de julio de 2022
Quality TranslationsA 40—Year Process!	Traducciones de calidad¡Un proceso de 40 años!
The Revelation Flourishes in the Philippines	La revelación florece en Filipinas
Serving as Trustees of Urantia Foundation	Sirviendo como fideicomisarios de la Fundación Urantia
The Cultural Advisory Council Welcomes Colombia	El Consejo Consultivo Cultural da la bienvenida a Colombia
Growing a School out of Love for the Revelation	Hacer crecer una escuela por amor a la Revelación
Sharing The Urantia Book	Compartiendo el libro de Urantia
What The Urantia Book Means to Me	Lo que el libro de Urantia significa para mí
Announcements	Anuncios
Volume 16, Issue 5, Dec. 2022	Volumen 16, Número 5, diciembre de 2022
Welcome & Contact Details	Bienvenido y detalles de contacto
The Assurance of God's Unbreakable Promises	La seguridad de las promesas inquebrantables de Dios
Updates from the October 2022 Trustee Meeting	Actualizaciones de la reunión de administradores de octubre de 2022
The Cultural Advisory Council Welcomes Poland	El Consejo Asesor Cultural da la bienvenida a Polonia
Nurturing the Revelation in the Philippines	Alimentando la revelación en Filipinas
Our Urantia Book Stand at the Cali, Colombia Bookfair	Nuestro stand del Libro de Urantia en la Feria del Libro de Cali, Colombia
Third European Conference of Urantia Book Readers—Overcoming Materialism and Enlightening Europe	Tercera Conferencia Europea de Lectores del Libro de Urantia: superar el materialismo e iluminar a Europa
Sharing The Urantia Book	Compartiendo el libro de Urantia
What The Urantia Book Means to Me	Lo que el libro de Urantia significa para mí
Announcements	Anuncios
Volume 17, 2023	Volumen 17, 2023
Volume 17, Issue 1, March 2023	Volumen 17, Número 1, marzo de 2023
Welcome & Contact Details	Bienvenido y detalles de contacto
The Mustard Seed Grants Program	El programa de subvenciones para semillas de mostaza
Updates from the January 2023 Trustee Meeting	Actualizaciones de la reunión de administradores de enero de 2023
An Epochal Plan	Un plan de época
Urantia Book International School Virtual Study Groups	Grupos de estudio virtuales de la Escuela Internacional del Libro de Urantia
Remembering Tonia Baney	Recordando a Tonia Baney
What The Urantia Book Means to Me	Lo que el libro de Urantia significa para mí
Announcements	Anuncios




