God’s Little Three-Digit Joke on Quantum Science	La pequeña broma de tres dígitos de Dios sobre la ciencia cuántica
An Old-Fashioned Conference of Urantia Believers at Unity Village	Una conferencia a la antigua usanza de creyentes de Urantia en Unity Village
Are You an Unused Urantia Resource?	¿Es usted un recurso Urantia no utilizado?
Buckminster Fuller’s Life-Changing Experience	La experiencia transformadora de Buckminster Fuller
If We Build It, Will They Come?	Interfaz: Si la construimos, ¿vendrán?
Aware of a Better Choice	Conscientes de una mejor elección
The History of the Spiritual Fellowship	La Historia de la Fellowship Espiritual
Quantum Mysteries and The Urantia Papers ( Part I )	Misterios cuánticos y los documentos de Urantia, Parte I de II
A Service Adventure in Guatemala	Una aventura de servicio en Guatemala por Micah Kruger
Let's Go Public	Hagámoslo público
Compare: Human Concepts Paralleled with The Urantia Papers	Compárese: Conceptos humanos paralelos a los documentos de Urantia
Our Urantian in Pakistan	Nuestro urantiano en Pakistán: extractos de las cartas de Nadia a J.J. Johnson
The Man Nobody Knows ( Part I )	El hombre que nadie conoce, un descubrimiento del verdadero Jesús. Parte 1 de 3 partes
Volume 13 — 2003	Volumen 13 — 2003
Spring 2003	Primavera 2003
Issue Content, Spring 2003	Spiritual Fellowship Journal — Contenido del número, primavera de 2003
The Nadia Factor	El factor Nadia
A Transition Period	Un período de transición
Observations on Religious Institutions	Interfaz: Observaciones sobre las instituciones religiosas
Quantum Mysteries and The Urantia Papers ( Part II )	Misterios cuánticos y los documentos de Urantia: Parte II
Unique Urantian Outreach	Alcance urantiano único
Personal and Global Peace	Paz personal y global
Where are the Great Urantia Leaders and Teachers?	¿Dónde están los grandes líderes y maestros de Urantia?
Is this a Boring Movement?	¿Es este un movimiento aburrido?
God's Orchestra	La orquesta de Dios
God within Our Daily Life and our Eternity Adventure	Dios en nuestra vida diaria y nuestra aventura en la eternidad
The Man Nobody Knows ( Part II )	El hombre que nadie conoce. Parte II
Fall 2003	Otoño 2003
Issue Content, Fall 2003	Spiritual Fellowship Journal — Contenido del número, otoño de 2003
The Sherman Diaries	Los diarios de Sherman
Creative Outreach: Adjusting our Perspective	Ajustando nuestra perspectiva
Leadership for Spiritual Communities	Liderazgo para comunidades espirituales
Sir Hubert Wilkins: 20th Century Magellan, Early Urantian	Sir Hubert Wilkins
Eugenics and the Urantia Papers	La eugenesia y los documentos de Urantia: minas terrestres
Eugenics and the Urantia Papers: A Different View	La eugenesia y los documentos de Urantia: una visión diferente
Spiritual Outreach for Spiritual Fellowships	Alcance espiritual para becas espirituales
God and Lady	Dios y la Señora
The Man Nobody Knows ( Part III )	El hombre que nadie conoce - Parte 3
Volume 14 — 2004	Volumen 14 — 2004
Fall 2004	Otoño 2004
Issue Content, Fall 2004	Spiritual Fellowship Journal — Contenido del número, otoño de 2004
Transitions...	Transiciones...
Religion in Transition	Religión en transición
The Joy of Living ina New Age	La alegría de vivir al límite
Are We Starting a New Religion?	¿Estamos comenzando una nueva religión?
Should a Urantia Church be Formed?	¿Debería formarse una Iglesia Urantia?
Prayer and Worship — As We Should Understand It	Oración y adoración como debemos entenderla
The Challenge ( Part I )	El desafío: Parte 1
Jesus and the Cross	Jesús y la cruz
Actualizing a New Organizational Paradigm	Actualizando un nuevo paradigma organizacional
Poison, Parables, and Paradise	Veneno, parábolas y paraíso
Volume 15 — 2005	Volumen 15 — 2005
Spring 2005	Primavera 2005
Issue Content, Spring 2005	Spiritual Fellowship Journal — Contenido del número, primavera de 2005
Reflections on a Long Winter	Reflexiones sobre un largo invierno...
Toward Spiritual Fellowship	Hacia el compañerismo espiritual
The Challenge ( Part II )	El desafío: Parte II
A Careful Examination of the “Not Inspired” Disclaimers of The Urantia Book (Part I)	Un examen cuidadoso de las exenciones de responsabilidad «no inspiradas» del libro de Urantia, parte 1
Significant Books: “Astrobiology: The Origins of Life and the Death of Darwinism” by Rhawn Joseph	Libros importantes: «Astrobiología: Los orígenes de la vida y la muerte del darwinismo», por Rhawn Joseph
On the Supreme: An Essay	Sobre El Supremo: un ensayo
Fall 2005	Otoño 2005
Issue Content, Fall-Winter 2005	Spiritual Fellowship Journal — Contenido del número, Otoño-Invierno 2005
Looking for Alternative Communities	Buscando comunidades alternativas
Religious Pluralism	Pluralismo religioso
Global Preparation	Preparación Global
A Careful Examination of the “Not Inspired” Disclaimers of The Urantia Book (Part II)	Un examen cuidadoso de las exenciones de responsabilidad «no inspiradas» del libro de Urantia (Parte 2)
Significant Books: Joy At Work	Libros importantes: alegría en el trabajo
Living the Teachings	Viviendo las enseñanzas
Pioneers in the New Age	Pioneros en la Nueva Era
Fusion Power	Poder de fusión
Sermon: Ye Shall Know the Truth	Conoceréis la verdad
Volume 16 — 2006	Volumen 16 — 2006
Spring 2006 — Last Issue	Primavera 2006 — Último número
Issue Content, Spring 2006	Spiritual Fellowship Journal — Contenido del número, primavera de 2006
Gifts and Graces of the Urantia Community	Regalos y gracias de la comunidad Urantia
Christianity in Transition	El cristianismo en transición
Urantia Brotherhood — Origin, History, and Destiny	Hermandad Urantia: origen, historia y destino
The Call to Ministry	El llamado al ministerio
Jesus' Confrontational Technique	Técnica de enseñanza de confrontación de Jesús
Spiritual Practice and Individual Lectio Divina	Práctica Espiritual e Individual. Lectio Divina
A Tale of Two Orvontons	Una historia de dos Orvontons
What Constitutes The Art of Teaching	Lo que constituye el arte de enseñar