Index of Innerface International articles	https://urantia-book.org/archive/newsletters/innerface/index.html	is-title	Innerface International
Volume 1 — 1994	---	is-volume	---
Volume 1 - No. 1	/image/article/Innerface_covers/volume1_no1.jpg	is-issue	---
A Time for Change?	/en/article/Ken_Glasziou/A_Time_for_Change	Ken Glasziou	Religion, Revelation
Insights	/en/article/Everett_Sloffer/Insights	Everett Sloffer	Religion, Spirituality
Do You Want Your Children to Like You? Jesus Provided a Model	/en/article/Ann_Bendall/Do_You_Want_Your_Children_to_Like_You	Ann Bendall	Family, Jesus, Jesus life, Psychology, Sociology
Further Comments on Channeling	/en/article/Meredith_Sprunger/Further_Comments_on_Channeling	Meredith Sprunger	Channeling
I Want to be Aggressive	/en/article/Ann_Bendall/I_Want_to_be_Aggressive	Ann Bendall	Psychology, Religion
On the Urgent Need for Secondary Works	/en/article/On_the_Urgent_Need_for_Secondary_Works	---	Religion, The Urantia Book
Volume 1 - No. 2	/image/article/Innerface_covers/volume1_no2.jpg	is-issue	---
Time for More Change? Symbols, Cults, and _The Urantia Book_	/en/article/Ken_Glasziou/Time_for_More_Change_Symbols_Cults	Ken Glasziou	Religion, The Urantia Book
The Alpha and the Omega	/en/article/Ken_Glasziou/The_Alpha_and_the_Omega	Ken Glasziou	Religion
Unbroken Communion with our Thought Adjuster	/en/article/Ann_Bendall/Unbroken_Communion_with_our_Thought_Adjuster	Ann Bendall	Psychology, Thought Adjusters
Was the Crucifixion really Necessary?	/en/article/Ken_Glasziou/Was_the_Crucifixion_Really_Necessary	Ken Glasziou	Religion, Theology
Adam and Eve	/en/article/Ann_Bendall/Adam_and_Eve	Ann Bendall	Religion, The Urantia Book
The Remembrance Supper	/en/article/The_Remembrance_Supper	---	Religion, The Urantia Book
Harmony: The One Universal Code of Communication	/en/article/Ann_Bendall/Harmony_The_One_Universal_Code_of_Communication	Ann Bendall	Psychology
Volume 1 - No. 3	/image/article/Innerface_covers/volume1_no3.jpg	is-issue	---
The Prodigal Son	/en/article/Ann_Bendall/The_Prodigal_Son	Ann Bendall	Jesus, Jesus teachings, Religion
When is a “Heart” not a “Heart?”	/en/article/Ken_Glasziou/When_is_a_Heart_not_a_Heart	Ken Glasziou	Jesus, Jesus teachings, Religion
The Missing Link	/en/article/Ken_Glasziou/The_Missing_Link	Ken Glasziou	Religion, The Urantia Book
Heart—the Alpha and Omega of Spirituality	/en/article/Rob_Crickett/Heart_Alpha_and_Omega_of_Spirituality	Rob Crickett	Religion
The Heart that became Loveless	/en/article/Ann_Bendall/The_Heart_that_Became_Loveless	Ann Bendall	Psychology, The Urantia Book
Jealousy, the Heart-Poison! How did Jesus deal with it?	/en/article/Ann_Bendall/Jealousy_the_Heart_Poison_How_did_Jesus_deal_with_it	Ann Bendall	Jesus, Jesus teachings, Psychology
High on Angels	/en/article/Dick_Bain/High_on_Angels	Dick Bain	Angels and midwayers, Religion, The Urantia Book
The Second Great Commandment	/en/article/Ken_Glasziou/The_Second_Great_Commandment	Ken Glasziou	Jesus, Jesus teachings, The Urantia Book
Science and The Urantia Book. When Did the Red Man Arrive in the Americas?	/en/article/Ken_Glasziou/When_Did_the_Red_Man_Arrive_in_the_Americas	Ken Glasziou	Anthropology
Primate Ancestry	/en/article/Ken_Glasziou/Primate_Ancestry	Ken Glasziou	Anthropology
Volume 1 - No. 4	/image/article/Innerface_covers/volume1_no4.jpg	is-issue	---
Nouveau-Assertiveness	/en/article/Jacques_Tetrault/Nouveau_Assertiveness	Jacques Tetrault	Sociology, Spirituality
Cognitive Dissonance. Can The Urantia Book help?	/en/article/Ann_Bendall/Cognitive_Dissonance_Can_The_Urantia_Book_help	Ann Bendall	Jesus, Jesus teachings, Morality, Psychology
DEFRAG	/en/article/Ken_Glasziou/DEFRAG	Ken Glasziou	Jesus, Jesus teachings, Morality
Jesus, Man, and Myth	/en/article/Dick_Bain/Jesus_Man_and_Myth	Dick Bain	Jesus, Jesus teachings, Religion
Another and Greater John the Baptist!	/en/article/Ann_Bendall/Another_and_Greater_John_the_Baptist	Ann Bendall	Morality, Psychology
Plan A. What was it?	/en/article/Ken_Glasziou/Plan_A_What_was_it	Ken Glasziou	God, Jesus, Jesus teachings
Science and The Urantia Book. Origins of Andon and Fonta	/en/article/Ken_Glasziou/Origins_of_Andon_and_Fonta	Ken Glasziou	Anthropology, Biology, Genetics
When did “life” start on Urantia?	/en/article/Ken_Glasziou/When_did_life_start_on_Urantia	Ken Glasziou	Anthropology, Biology, Genetics
Volume 1 - No. 5	/image/article/Innerface_covers/volume1_no5.jpg	is-issue	---
The Parliament of the World's Religions	/en/article/Byron_Belitsos/The_Parliament_of_The_Worlds_Religions	Byron Belitsos	Religion
Apartheid Mandeled	/en/article/Joanne_Scheffler/Apartheid_Mandeled	Joanne Scheffler	Love and the Golden Rule, Jesus teachings
Adversity and the Spiritual Value of Disappointment	/en/article/Ian_Stephen/Adversity_and_the_Spiritual_Value_of_Disappointment	Ian Stephen	Psychology, The Urantia Book
It's a Worry	/en/article/William_Wentworth/Its_a_Worry	William Wentworth	The Urantia Book
Do We All Have a Soul?	/en/article/Ron_Cyr/Do_We_All_Have_A_Soul	Ron Cyr	The Urantia Book
The Real Gospel	/en/article/Norm_Duval/The_Real_Gospel	Norm Duval	Religion, Jesus, Jesus teachings
More About Secondary Works	/en/article/Elizabeth_Mitchell/More_about_Secondary_Works	Elizabeth Mitchell	The Urantia Book
Better Communication with My Thought Adjuster	/en/article/Ann_Bendall/Better_Communication_with_My_Thought_Adjuster	Ann Bendall	Thought Adjusters
Science and The Urantia Book. The Mesotron	/en/article/Ken_Glasziou/Science_and_The_Urantia_Book_The_Mesotron	Ken Glasziou	Physics
Volume 1 - No. 6	/image/article/Innerface_covers/volume1_no6.jpg	is-issue	---
Only God is Good	/en/article/Ken_Glasziou/Only_God_is_Good	Ken Glasziou	God, Morality
Parable of a Parrot	/en/article/Ken_Glasziou/Parable_of_a_Parrot	Ken Glasziou	Morality
Who was Rodan?	/en/article/Ken_Glasziou/Who_was_Rodan	Ken Glasziou	Jesus, Jesus teachings, Morality
Music Functions and Change	/en/article/Ann_Bendall/Music_Functions_and_Changes	Ann Bendall	Music, Psychology
The Urantia Book: Why are its readers challenged with over 2000 pages of profuse facts and prodigious names???	/en/article/Sue_Tennant/The_Urantia_Book_Why_are_its_readers_challenged	Sue Tennant	Morality, The Urantia Book, The Urantia Book—Purpose
Ravening Wolves, Swine, et al	/en/article/Ann_Bendall/Ravening_Wolves_Swine_Dogs_Sheep_Serpents_and_Doves	Ann Bendall	Jesus, Jesus teachings
Pain and Conflict in Time and Space	/en/article/Robert_Webb/Pain_and_Conflict_in_Time_and_Space	Robert Webb	Morality
Neutrinos, Neutrons, and Neutron Stars	/en/article/Ken_Glasziou/Neutrinos_neutrons_and_neutron_stars	Ken Glasziou	Physics
Volume 2 — 1995	---	is-volume	---
Volume 2 - No. 1	/image/article/Innerface_covers/volume2_no1.jpg	is-issue	---
Limitations of Revelation	/en/article/Ken_Glasziou/Limitations_of_Revelation	Ken Glasziou	Revelation, The Urantia Book
The Urantia Book. Why are some people turned off it and others love it?	/en/article/Ann_Bendall/Why_are_some_people_turned_off_it_and_others_love_it	Ann Bendall	Morality, Psychology, The Urantia Book
The Purpose and Limitations of the Fifth Epochal Revelation	/en/article/Ken_Glasziou/The_Purpose_and_Limitations_of_the_5th_Epochal_Revelation	Ken Glasziou	God, Purpose, Revelation, The Urantia Book, The Urantia Book—Purpose
On the Revelatory Status of The Urantia Book	/en/article/Ken_Glasziou/On_the_Revelatory_Status_of_the_Urantia_Book	Ken Glasziou	Cosmology, Revelation, The Urantia Book, The Urantia Book—Purpose, The Urantia Book—Errors
Beethovan's Song of Joy	/en/article/Ann_Bendall/Song_of_Joy	Ann Bendall	Art
On Faith	/en/article/Ken_Glasziou/On_Faith	Ken Glasziou	God, Faith
Quantum Theory, The Urantia Book, and the Absolutes	/en/article/Ken_Glasziou/Quantum_Theory_The_Urantia_Book_and_the_Absolutes	Ken Glasziou	Physics
Volume 2 - No. 2	/image/article/Innerface_covers/volume2_no2.jpg	is-issue	---
Not If, But When	/en/article/Dick_Bain/Not_If_But_When	Dick Bain	Church, Religion
Limitations to Revelation	/en/article/Ann_Bendall/Limitations_of_Revelation_2	Ann Bendall	Church, God, Jesus, Jesus teachings, Revelation
Parental Guilt	/en/article/Jacques_Tetrault/Parental_Guilt	Jacques Tetrault	Morality, Psychology
Divine Music	/en/article/Sandy_Garrick/Divine_Music	Sandy Garrick	Art, Music, Jesus, Jesus teachings
On Space and Nothing	/en/article/Robert_Webb/On_Space_and_Nothing	Robert Webb	Cosmology
The Rebuke to One Friend in Defence of Another	/en/article/Ann_Bendall/The_Rebuke_to_One_Friend_in_Defence_of_Another	Ann Bendall	Jesus, Jesus teachings, Morality
Aristotle, Fuzzy Logic, and The Urantia Book	/en/article/Ken_Glasziou/Aristotle_Fuzzy_Logic_and_The_Urantia_Book	Ken Glasziou	Psychology, The Urantia Book
On Fuzzy Thinking	/en/article/Ken_Glasziou/On_Fuzzy_Thinking	Ken Glasziou	Psychology, Logic, Mathematics
Gravity, Newton, Einstein, and The Urantia Book	/en/article/Ken_Glasziou/Gravity_Newton_Einstein_and_The_Urantia_Book	Ken Glasziou	Physics
Volume 2 - No. 3	/image/article/Innerface_covers/volume2_no3.jpg	is-issue	---
A Chance Meeting	/en/article/Ann_Bendall/A_Chance_Meeting	Ann Bendall	The Urantia Book
Unselfishness. Its Relationship to God-Consciousness and Religious Experience	/en/article/Ken_Glasziou/Unselfishness_Its_Relationship_to_God_Consciousness_and_Religious_Experience	Ken Glasziou	Spirituality, Thought Adjusters
Morality, Motive, and Virtue	/en/article/Ken_Glasziou/Morality_Motive_and_Virtue	Ken Glasziou	Morality
The Urantia Book and Secondary Works	/en/article/Ken_Glasziou/The_Urantia_Book_and_Secondary_Works	Ken Glasziou	Church, Morality
Beyond Fundamentalism	/en/article/Meredith_Sprunger/Beyond_Fundamentalism	Meredith Sprunger	Revelation, The Urantia Book
Midrash	/en/article/Ken_Glasziou/Midrash	Ken Glasziou	Revelation
Self-fulfilling Prophecy	/en/article/Ann_Bendall/Self_Fulfilling_Prophecy	Ann Bendall	Psychology
The Death of Forever: A new future for human Consciousness	/en/article/Darryl_Reanney/The_Death_of_Forever_A_new_future_for_human_consciousness	Darryl Reanney	Morality, Psychology
Little Things Mean a Lot—Do neutrinos have mass?	/en/article/Dick_Bain/Little_Things_Mean_a_Lot	Dick Bain	Physics
Volume 2 - No. 4	/image/article/Innerface_covers/volume2_no4.jpg	is-issue	---
Who Wrote The Urantia Book?	/en/article/Ken_Glasziou/Who_Wrote_The_Urantia_Book	Ken Glasziou	The Urantia Book—Authorship, History
Providing Urantianite Spiritual Leadership	/en/article/Rob_Crickett/Providing_Urantianite_Spiritual_Leadership	Rob Crickett	Spirituality
Non-Breathers: Very Odd Neighbors	/en/article/Dick_Bain/Very_Odd_Neighbors	Dick Bain	Biology, Genetics
James, the brother of Jesus. What happened to him?	/en/article/Ken_Glasziou/James_the_Brother_of_Jesus_What_happened_to_him	Ken Glasziou	Jesus, Jesus life
Decisions, Decisions—the Doing of God's Will	/en/article/Ann_Bendall/Decisions_Decisions_the_Doing_of_Gods_Will	Ann Bendall	Psychology
Relating!	/en/article/Jacques_Tetrault/Relating	Jacques Tetrault	Global Seeding
The Religions of Man	/en/article/Ann_Bendall/The_Religions_of_Man	Ann Bendall	Jesus, Jesus teachings, Religion
Do We Need Another Church	/en/article/Gloria_and_Ray_Colot/Do_We_Need_Another_Church	Gloria and Ray Colot	Church
Turning Point!!	/en/article/Ken_Glasziou/Turning_Point	Ken Glasziou	God, The Urantia Book
The Jupiter Problem	/en/article/Dick_Bain/The_Jupiter_problem	Dick Bain	Astronomy
Volume 2 - No. 5	/image/article/Innerface_covers/volume2_no5.jpg	is-issue	---
“Let There Be Light”	/en/article/Ken_Glasziou/Let_There_Be_Light	Ken Glasziou	God, Jesus, Jesus teachings
Personal Religion: A Sign of the Times	/en/article/Jacques_Tetrault/Personal_Religion_A_Sign_of_the_Times	Jacques Tetrault	God
Wouldn't It be Great If?	/en/article/Ken_Glasziou/Wouldnt_It_Be_Great_If	Ken Glasziou	Sociology
Self Esteem	/en/article/Ann_Bendall/Self_Esteem	Ann Bendall	Psychology
The Second Great Commandment. A Reminder	/en/article/Ken_Glasziou/The_Second_Great_Commandment_A_Reminder	Ken Glasziou	Jesus, Jesus teachings, Spirituality
What Am I?	/en/article/Ken_Glasziou/What_Am_I	Ken Glasziou	Personality, Thought Adjusters
A True Story	/en/article/A_True_Story	---	Sociology
Hinduism	/en/article/Hinduism	---	Religion, Hinduism
Concepts of the Absolute	/en/article/Ken_Glasziou/Concepts_of_the_Absolute	Ken Glasziou	Religion
Judgment Day	/en/article/Ann_Bendall/Judgment_Day	Ann Bendall	Religion, The Urantia Book
Twinkle, Twinkle	/en/article/Dick_Bain/Twinkle__Twinkle	Dick Bain	Astronomy
Birth of the Solar System	/en/article/Ken_Glasziou/Birth_of_the_Solar_System	Ken Glasziou	Astronomy
Wave Energy Octets	/en/article/Frederick_Beckner/Wave_energy_octaves	Frederick Beckner	Physics
Archaeology and The Urantia Book. Tin in Turkey	/en/article/Matt_Neibaur/Archaeology_and_The_Urantia_Book_Tin_in_Turkey	Matt Neibaur	Archaeology
Volume 2 - No. 6	/image/article/Innerface_covers/volume2_no6.jpg	is-issue	---
On Copyright and Plagiarism	/en/article/Matt_Neibaur/On_Copyright_and_Plagiarism	Matt Neibaur	The Urantia Book
Answers from The Urantia Book	/en/article/Answers_from_The_Urantia_Book	---	The Urantia Book
God-Playing	/en/article/Earl_Jabay/God_playing	Earl Jabay	God
Remarks on Suicide	/en/article/Robert_Walker/Remarks_on_Suicide	Robert Walker	Adversity, Personal growth, Life after death
Archaeology and The Urantia Book	/en/article/Ken_Glasziou/Archaeology_and_The_Urantia_Book	Ken Glasziou	Archaeology
Tarichea	/en/article/Ken_Glasziou/Tarichea	Ken Glasziou	Archaeology, Jesus, Jesus' places
A Leap of Faith	/en/article/Dick_Bain/A_leap_of_faith	Dick Bain	The Urantia Book, Faith
Those Christians	/en/article/Ann_Bendall/Those_Christians	Ann Bendall	Jesus teachings
Zwicky	/en/article/Ken_Glasziou/Zwicky	Ken Glasziou	Astronomy, Physics
Volume 3 — 1996	---	is-volume	---
Volume 3 - No. 1	/image/article/Innerface_covers/volume3_no1.jpg	is-issue	---
Editorial: Martin Gardner's Urantia, The Great Cult Mystery	/en/article/Ken_Glasziou/Editorial_Martin_Gardners_Urantia_The_Great_Cult_Mystery	Ken Glasziou	The Urantia Book, Gardner
Martin Gardner's The Great Cult Mystery a review	/en/article/Dick_Bain/Martin_Gardners_Urantia_The_Great_Cult_Mystery	Dick Bain	The Urantia Book, Gardner
The Purpose of Revelation: A Response to Martin Gardner's Urantia: The Great Cult Mystery	/en/article/Meredith_Sprunger/The_Purpose_of_Revelation	Meredith Sprunger	Gardner, Purpose, Revelation, The Urantia Book, The Urantia Book—Purpose
Reading The Urantia Book as a Religious Practice	/en/article/David_Kantor/Reading_The_Urantia_Book_as_a_Religious_Practice	David Kantor	Jesus, Jesus teachings, Sociology, Thought Adjusters
A response to some of the Gardner criticisms	/en/article/Ken_Glasziou/A_response_to_some_of_the_Gardner_criticisms	Ken Glasziou	The Urantia Book, Gardner
Volume 3 - No. 2	/image/article/Innerface_covers/volume3_no2.jpg	is-issue	---
As Jesus Passed By	/en/article/As_Jesus_Passed_By	---	Jesus, Jesus teachings
Consistency and Continuity	/en/article/Ann_Bendall/Consistency_and_Continuity	Ann Bendall	Psychology
Keys to the Kingdom	/en/article/Ann_Bendall/Keys_to_the_Kingdom	Ann Bendall	Morality
How Christian is The Urantia Book	/en/article/Dick_Bain/How_Christian_is_The_Urantia_Book	Dick Bain	Religion
The Urantia Book. What is it and why is it so?	/en/article/Ken_Glasziou/The_Urantia_Book_What_is_it_and_why_is_it_so	Ken Glasziou	Purpose, Revelation, The Urantia Book, The Urantia Book—Purpose
No Man Ever Spake Thus	/en/article/Ken_Glasziou/No_Man_Ever_Spake_Thus	Ken Glasziou	Revelation, The Urantia Book
A Conundrum for the Hardcore Fundamentalists	/en/article/Ken_Glasziou/A_Conundrum_for_the_Hardcore_Fundamentalists	Ken Glasziou	Revelation, The Urantia Book, The Urantia Book—Errors
Neutrinos and Neutron Stars	/en/article/Ken_Glasziou/Neutrinos_neutrons_and_neutron_stars	Ken Glasziou	Physics
Volume 3 - No. 3	/image/article/Innerface_covers/volume3_no3.jpg	is-issue	---
On Prayer and Faith	/en/article/Favorite_Places_On_Prayer_and_Faith	---	Jesus, Jesus teachings
The Challenge of the Twenty First Century	/en/article/Meredith_Sprunger/The_Challenge_of_the_Twenty_first_Century	Meredith Sprunger	Psychology, Sociology
The Scandal of Current Spiritual Cosmology	/en/article/Meredith_Sprunger/The_Scandal_of_Current_Spiritual_Cosmology	Meredith Sprunger	Spirituality, The Urantia Book
Here and There	/en/article/Q_P_Quid/Here_and_There	Q. P. Quid	Spirituality, The Urantia Book
Science and Archaeology in The Urantia Book	/en/article/Ken_Glasziou/Science_and_Archaeology_in_The_Urantia_Book	Ken Glasziou	Archaeology
Matthew Block's Vision on Urantia Book Science and Archaeology	/en/article/Matthew_Block/Science_and_Archaeology_in_the_Urantia_Papers	Matthew Block	Archaeology, The Urantia Book
Bethsaida and The Urantia Book	/en/article/Ken_Glasziou/Bethsaida_and_The_Urantia_Book	Ken Glasziou	Archaeology, Jesus, Jesus life
Bethsaida-Julias and Bethsaida of Galilee	/en/article/Stephen_Finlan/Bethsaida_Julias_and_Bethsaida_of_Galilee	Stephen Finlan	Archaeology, Jesus, Jesus life, Jesus places'
Surfing the Sunbeams: Calcium, the Wanderer of Space	/en/article/Ken_Glasziou/Surfing_the_Sunbeams_Calcium_Wanderer_Space	Ken Glasziou	Astronomy
Volume 3 - No. 4	/image/article/Innerface_covers/volume3_no4.jpg	is-issue	---
A Discourse on Religion	/en/article/Ken_Glasziou/A_Discourse_on_Religion	Ken Glasziou	Religion
Ancient Cyprus and The Urantia Book	/en/article/Stefan_Tallqvist/Ancient_Cyprus_and_The_Urantia_Book	Stefan Tallqvist	Archaeology, The Urantia Book
Defamation of Character	/en/article/Georgina_Merrill/Defamation_of_Character	Georgina Merrill	Morality
Why did Jesus come to Urantia?	/en/article/Ken_Glasziou/Why_Did_Jesus_come_to_Urantia	Ken Glasziou	God, Jesus, Jesus teachings, Thought Adjusters
Consistency in The Urantia Book	/en/article/Ken_Glasziou/Consistency_in_The_Urantia_Book	Ken Glasziou	Gardner, The Urantia Book
Steady State, Big Bang, or Architects of the Master Universe	/en/article/Dick_Bain/Steady_State_Big_Bang_or_Architects_of_the_Master_Universe	Dick Bain	The Urantia Book
Paddling against the Tide	/en/article/Ken_Glasziou/Paddling_Against_the_Tide	Ken Glasziou	The Urantia Book
Volume 3 - No. 5	/image/article/Innerface_covers/volume3_no5.jpg	is-issue	---
About the Universal Father	/en/article/Ken_Glasziou/About_the_Universal_Father_3	Ken Glasziou	God, Jesus, Jesus teachings
Positivism—The Only Way	/en/article/Ken_Glasziou/About_the_Universal_Father_3	Ken Glasziou	Philosophy
The Secondary Midwayers	/en/article/Ken_Glasziou/The_Secondary_Midwayers	Ken Glasziou	Revelation, The Urantia Book
The Celestial Guardians	/en/article/Ken_Glasziou/The_Celestial_Guardians	Ken Glasziou	The Urantia Book
On Uncertainties	/en/article/Ken_Glasziou/On_Uncertainties	Ken Glasziou	Morality
What are Dreams Made of?	/en/article/Robert_Walker/What_Are_Dreams_Made_Of	Robert Walker	Morality
Without or Within	/en/article/Ken_Glasziou/Without_or_Within	Ken Glasziou	Jesus, Jesus teachings, Morality, Religion, Thought Adjusters
Black Holes Re-visited	/en/article/Dick_Bain/Black_Holes_Re_visited	Dick Bain	Astronomy
Volume 3 - No. 6	/image/article/Innerface_covers/volume3_no6.jpg	is-issue	---
A Christmas Message from Jesus	/en/article/Ken_Glasziou/A_Christmas_Message_to_all_Urantia_Book_Readers	Ken Glasziou	Jesus, Jesus teachings, Morality
Jesus would not appeal to the Moral Majority	/en/article/Sydney_Harris/Jesus_would_not_appeal_to_the_Moral_Majority	Sydney Harris	Jesus, Jesus teachings, Morality
On Being Morally Fragrant	/en/article/Ken_Glasziou/On_Being_Morally_Fragrant	Ken Glasziou	Morality
The Science and Historical Content of The Urantia Book	/en/article/Ken_Glasziou/The_Science_and_Historical_Content_of_The_Urantia_Book	Ken Glasziou	History, Revelation
Consistency Column	/en/article/Ken_Glasziou/Consistency_Column	Ken Glasziou	Revelation
My Odyssey of Peak Experiences	/en/article/Meredith_Sprunger/My_Odyssey_of_Peak_Experiences	Meredith Sprunger	The Urantia Book
Cosmology of the Material Universes. Why Science and The Urantia Book have different perspectives	/en/article/Cosmology_of_the_Material_Universes	---	The Urantia Book
Volume 4 — 1997	---	is-volume	---
Volume 4 - No. 1	/image/article/Innerface_covers/volume4_no1.jpg	is-issue	---
Faith Sons of God	/en/article/Ken_Glasziou/The_Faith_Sons_of_God	Ken Glasziou	God, Thought Adjusters
Convergence—The Science Content of The Urantia Book	/en/article/Ken_Glasziou/Convergence_The_Science_Content_of_The_Urantia_Book	Ken Glasziou	Gardner, Physics
Reflections on the Dangers of Presumption	/en/article/Ann_Bendall/Reflections_on_The_Dangers_of_Presumption	Ann Bendall	God, Jesus, Jesus teachings
Walking the Second Mile	/en/article/Sydney_Harris/Walking_the_Second_Mile	Sydney Harris	Morality, Religion
Volume 4 - No. 2	/image/article/Innerface_covers/volume4_no2.jpg	is-issue	---
Truth and Faith	/en/article/Ken_Glasziou/Truth_and_Faith	Ken Glasziou	Morality, Revelation
On Communication with our Thought Adjuster	/en/article/Ken_Glasziou/On_Communication_with_our_Thought_Adjuster	Ken Glasziou	Jesus, Jesus teachings, Morality, Thought Adjusters
Swann, Gardner, and The Urantia Book—Protons and Electrons	/en/article/Ken_Glasziou/Swann_Gardner_and_The_Urantia_Book	Ken Glasziou	Gardner
Beliefs and Values	/en/article/Ann_Bendall/Beliefs_and_Values	Ann Bendall	Morality, Psychology
A God of Fundamentals who is a Light, not a Lash	/en/article/Sydney_Harris/A_God_of_Fundamentals_Who_is_a_Light_Not_a_Lash	Sydney Harris	Church, God
Consistency in The Urantia Book—Personality	/en/article/Jacques_Dupont/Consistency_in_The_Urantia_Book_Personality	Jacques Dupont	Personality, Revelation, The Urantia Book
Correspondence from Stanley McTrusty	/en/article/Stanley_McTrusty/Correspondence_from_Stanley_McTrusty	Stanley McTrusty	Religion
Mars: The Bearer of Life?	/en/article/Dick_Bain/Mars_The_Bearer_of_Life	Dick Bain	Astronomy
Volume 4 - No. 3	/image/article/Innerface_covers/volume4_no3.jpg	is-issue	---
All Urantia is Waiting	/en/article/Ken_Glasziou/All_Urantia_is_Waiting	Ken Glasziou	Jesus, Jesus teachings, Spirituality
A Journey to the Stars	/en/article/Ken_Glasziou/A_Journey_to_the_Stars	Ken Glasziou	Cosmology, The Urantia Book
Need a Tune-Up	/en/article/Ken_Glasziou/Need_a_Tune_Up	Ken Glasziou	Spirituality, Thought Adjusters
Out of Context: Means, Ends, Motives and Morality	/en/article/Ken_Glasziou/Out_of_Context_Means_Ends_Motives_and_Morality	Ken Glasziou	Morality
Attunement Equals Peace	/en/article/Matthew_Block/Attunement_Equals_Peace	Matthew Block	Jesus, Jesus teachings, Religion, Hinduism, Christianity, Theology
Wrestling with Jesus	/en/article/Dick_Bain/Wrestling_with_Jesus	Dick Bain	Jesus, Jesus teachings
On Seeing Others as Benefactors	/en/article/Masami_Saionji/On_Seeing_Others_as_Benefactors	Masami Saionji	Morality
Heaven won't be Dull—Despite the Disbelievers	/en/article/Sydney_Harris/Heaven_wont_be_dull	Sydney Harris	Jesus, Jesus teachings
Evolution of the Solar System—the Role of Chaos	/en/article/Ken_Glasziou/Evolution_of_the_Solar_System	Ken Glasziou	Astronomy
Volume 4 - No. 4	/image/article/Innerface_covers/volume4_no4.jpg	is-issue	---
Prayer and Worship	/en/article/Ken_Glasziou/Prayer_and_Worship	Ken Glasziou	Spirituality
Has Quantum Physics discovered the Universal Father?	/en/article/Ken_Glasziou/Has_Quantum_Physics_Discovered_the_Universal_Father	Ken Glasziou	Physics
Heisenberg and God	/en/article/Ken_Glasziou/Heisenberg_and_God	Ken Glasziou	Physics
Well, Has It?	/en/article/Ken_Glasziou/Well_Has_It	Ken Glasziou	Physics
Spiritual Growth	/en/article/Ann_Bendall/Spiritual_Growth	Ann Bendall	Spirituality
Jesus' Respect for our Personality	/en/article/Leslie_Wetherhead/Jesus_Respect_for_Our_Personality	Leslie Wetherhead	Jesus, Jesus teachings
Volume 4 - No. 5	/image/article/Innerface_covers/volume4_no5.jpg	is-issue	---
The Divine Spirit Must Dominate...	/en/article/Ken_Glasziou/The_Divine_Spirit_must_dominate	Ken Glasziou	Thought Adjusters
What Does It Mean to Talk about God? A Catholic View	/en/article/Peter_Vardy/What_Does_It_Mean_to_Talk_about_God_A_Catholic_View	Peter Vardy	God, Religion, Theology
Why we need to know 'The Earthly Life of Jesus and How He Lived It.'	/en/article/Ken_Glasziou/Why_we_need_to_know_the_earthly_life_of_Jesus_and_how_he_lived_it	Ken Glasziou	Jesus, Jesus teachings, Morality, Thought Adjusters
A Urantia Cult	/en/article/Dick_Bain/A_Urantia_Cult	Dick Bain	Church, Religion
Intolerance	/en/article/Ann_Bendall/Intolerance	Ann Bendall	Jesus, Jesus teachings, Morality, Psychology
The Urantia Book. Why Is It So Strange?	/en/article/Ken_Glasziou/The_Urantia_Book_why_is_it_so_strange	Ken Glasziou	Morality, Purpose, Revelation, The Urantia Book, The Urantia Book—Purpose
More on the Gospel of the Kingdom	/en/article/Ken_Glasziou/More_on_the_gospel_of_the_kingdom	Ken Glasziou	Jesus, Jesus teachings, The Urantia Book
Volume 4 - No. 6	/image/article/Innerface_covers/volume4_no6.jpg	is-issue	---
The Father's Business	/en/article/Ken_Glasziou/The_Fathers_Business	Ken Glasziou	Jesus, Jesus teachings
The Urantia Papers. Was Immediate Publication Intended?	/en/article/Ken_Glasziou/The_Urantia_Papers_Was_Immediate_Publication_Intended	Ken Glasziou	Revelation, The Urantia Book
The 'E' Word	/en/article/Dick_Bain/The_E_Word	Dick Bain	Morality, The Urantia Book
Consciousness	/en/article/Ken_Glasziou/Consciousness	Ken Glasziou	Physics, Psychology
The Urantia Book and Moral Consciousness Extracts	/en/article/Ken_Glasziou/The_Urantia_Book_and_Moral_Consciousness	Ken Glasziou	Morality
The Quest. What is life about?	/en/article/Ken_Glasziou/The_Quest_What_is_life_about	Ken Glasziou	Cosmology, God, Purpose
Nothing but the Truth	/en/article/Sydney_Harris/Nothing_but_the_Truth	Sydney Harris	Morality
Conflict	/en/article/Conflict	---	Morality
Forty eight Chromosomes? Or Jumping to Conclusions	/en/article/Ken_Glasziou/48_Chromosomes_Or_Jumping_to_Conclusions	Ken Glasziou	Biology, Genetics
